perturbation_id	experiment_id	combination_id	perturbed_object	perturbation_type	technology	direct_target	construct_or_reagent	dose	duration	timing_relative_to_synchronization	control	expected_effect	expected_effect_basis	observed_validation	evidence_ids	notes
PT-P0001-001	EX-P0001-001	NA	cell-cycle state	not_applicable	not_applicable	NA	NA	NA	NA	NA	stage-matched cell-cycle populations	No targeted molecular perturbation was extracted beyond synchronization/arrest design.	round4_boundary	NA	E-P0001-001	Thymidine/nocodazole are recorded in conditions and samples_timepoints as synchronization/arrest, not as final target perturbation.
PT-P0008-001	EX-P0008-002	NA	condensin I and condensin II complexes	acute protein degradation	minimal auxin-inducible degron (mAID) with OsTIR1	SMC2	SMC2-mAID plus auxin	NR	3 h	auxin during 1NM-PP1-induced G2 arrest before release	SMC2+ before auxin and wild-type time course	disrupt both condensin I and II before mitotic entry	author_stated_design	SMC2 reduced below 5%；chromatids failed to resolve normally；cells failed normal mitotic exit	E-P0008-004	预期效果与观察结果分列
PT-P0008-002	EX-P0008-003	NA	condensin I	acute protein degradation	minimal auxin-inducible degron (mAID) with OsTIR1	CAP-H	CAP-H-mAID plus auxin	NR	NR	auxin during 1NM-PP1-induced G2 arrest before release	matched undepleted/WT condition	selectively deplete condensin I before mitotic entry	author_stated_design	CAP-H depletion exceeded 95%; phenotype was less severe than simultaneous condensin I/II loss	E-P0008-012	预期效果与观察结果分列；具体剂量/时长在当前正文证据不足时保留NR
PT-P0008-003	EX-P0008-004	NA	condensin II	acute protein degradation	minimal auxin-inducible degron (mAID) with OsTIR1	CAP-H2	CAP-H2-mAID plus auxin	NR	NR	auxin during 1NM-PP1-induced G2 arrest before release	matched undepleted/WT condition	selectively deplete condensin II before mitotic entry	author_stated_design	CAP-H2 depletion exceeded 95%; phenotype was less severe than simultaneous condensin I/II loss	E-P0008-012	预期效果与观察结果分列；具体剂量/时长在当前正文证据不足时保留NR
PT-P0009-001	EX-P0009-001	NA	cell-cycle state	not_applicable	not_applicable	NA	NA	NA	NA	NA	stage-matched post-mitotic populations	No targeted molecular perturbation was extracted beyond nocodazole arrest-release design.	round4_boundary	NA	E-P0009-001	Nocodazole is recorded as synchronization reagent; no gene/protein perturbation is claimed for this study design.
PT-P0012-001	EX-P0012-001	CTCF_AID	CTCF protein	acute protein degradation	auxin-inducible degron	CTCF	CTCF-AID-mCherry plus OsTIR and auxin	1 mM auxin	1 h or during release	during nocodazole-induced prometaphase arrest-release	no auxin matched controls	deplete CTCF during M-to-G1 chromatin reconfiguration	author_stated_design	CTCF became virtually undetectable after 1 h auxin exposure	E-P0012-001	CTCF depletion is separated from synchronization and from transcription inhibition.
PT-P0012-002	EX-P0012-001	transcription_inhibition	transcription initiation	chemical inhibition	triptolide	Pol II transcription initiation	triptolide	1 uM	2 h release condition	added during last hour of nocodazole and maintained during release	no triptolide matched controls	inhibit transcription during M-to-G1 transition	author_stated_design	transcription inhibition assayed with Hi-C context	E-P0012-003	Represented separately from CTCF AID depletion.
